{
  "schema": 1,
  "source_id": "src-05b9ebcb4d58",
  "sensitivity": "public",
  "tables": [
    {
      "id": "t01",
      "file": "t01.parquet",
      "locator": {
        "kind": "docx-table",
        "table": 1,
        "row_start": 1,
        "row_end": 6
      },
      "provenance": "deterministic-table",
      "columns": [
        {
          "name": "field",
          "header": "Field",
          "type": "VARCHAR"
        },
        {
          "name": "value",
          "header": "Value",
          "type": "VARCHAR"
        }
      ],
      "row_count": 5,
      "row_ids": [
        "r0002",
        "r0003",
        "r0004",
        "r0005",
        "r0006"
      ]
    },
    {
      "id": "t02",
      "file": "t02.parquet",
      "locator": {
        "kind": "docx-table",
        "table": 2,
        "row_start": 1,
        "row_end": 6
      },
      "provenance": "deterministic-table",
      "columns": [
        {
          "name": "activity",
          "header": "Activity",
          "type": "VARCHAR"
        },
        {
          "name": "limit",
          "header": "Limit",
          "type": "VARCHAR"
        }
      ],
      "row_count": 5,
      "row_ids": [
        "r0002",
        "r0003",
        "r0004",
        "r0005",
        "r0006"
      ]
    },
    {
      "id": "t03",
      "file": "t03.parquet",
      "locator": {
        "kind": "docx-table",
        "table": 3,
        "row_start": 1,
        "row_end": 3
      },
      "provenance": "deterministic-table",
      "columns": [
        {
          "name": "revision",
          "header": "Revision",
          "type": "VARCHAR"
        },
        {
          "name": "date",
          "header": "Date",
          "type": "VARCHAR"
        },
        {
          "name": "change",
          "header": "Change",
          "type": "VARCHAR"
        }
      ],
      "row_count": 2,
      "row_ids": [
        "r0002",
        "r0003"
      ]
    }
  ]
}
