{
  "schema": 1,
  "source_id": "src-1c261d5b87b5",
  "sensitivity": "public",
  "tables": [
    {
      "id": "t01",
      "file": "t01.parquet",
      "locator": {
        "kind": "pdf-page",
        "page": 1,
        "bbox": [
          0.0823,
          0.1327,
          0.9131,
          0.2991
        ]
      },
      "provenance": "native-text",
      "columns": [
        {
          "name": "field",
          "header": "Field",
          "type": "VARCHAR"
        },
        {
          "name": "value",
          "header": "Value",
          "type": "VARCHAR"
        }
      ],
      "row_count": 6,
      "row_ids": [
        "r0002",
        "r0003",
        "r0004",
        "r0005",
        "r0006",
        "r0007"
      ]
    },
    {
      "id": "t02",
      "file": "t02.parquet",
      "locator": {
        "kind": "pdf-page",
        "page": 2,
        "bbox": [
          0.0814,
          0.5234,
          0.9131,
          0.9253
        ]
      },
      "provenance": "native-text",
      "columns": [
        {
          "name": "item",
          "header": "Item",
          "type": "BIGINT"
        },
        {
          "name": "description",
          "header": "Description",
          "type": "VARCHAR"
        },
        {
          "name": "spare_part_number",
          "header": "Spare part number",
          "type": "VARCHAR"
        }
      ],
      "row_count": 16,
      "row_ids": [
        "r0002",
        "r0003",
        "r0004",
        "r0005",
        "r0006",
        "r0007",
        "r0008",
        "r0009",
        "r0010",
        "r0011",
        "r0012",
        "r0013",
        "r0014",
        "r0015",
        "r0016",
        "r0017"
      ]
    },
    {
      "id": "t03",
      "file": "t03.parquet",
      "locator": {
        "kind": "pdf-page",
        "page": 3,
        "bbox": [
          0.0815,
          0.1342,
          0.9131,
          0.3486
        ]
      },
      "provenance": "native-text",
      "columns": [
        {
          "name": "item",
          "header": "Item",
          "type": "VARCHAR"
        },
        {
          "name": "specification",
          "header": "Specification",
          "type": "VARCHAR"
        }
      ],
      "row_count": 8,
      "row_ids": [
        "r0002",
        "r0003",
        "r0004",
        "r0005",
        "r0006",
        "r0007",
        "r0008",
        "r0009"
      ]
    },
    {
      "id": "t04",
      "file": "t04.parquet",
      "locator": {
        "kind": "pdf-page",
        "page": 3,
        "bbox": [
          0.0812,
          0.4004,
          0.9131,
          0.5435
        ]
      },
      "provenance": "native-text",
      "columns": [
        {
          "name": "parameter",
          "header": "Parameter",
          "type": "VARCHAR"
        },
        {
          "name": "value",
          "header": "Value",
          "type": "VARCHAR"
        }
      ],
      "row_count": 5,
      "row_ids": [
        "r0002",
        "r0003",
        "r0004",
        "r0005",
        "r0006"
      ]
    },
    {
      "id": "t05",
      "file": "t05.parquet",
      "locator": {
        "kind": "pdf-page",
        "page": 3,
        "bbox": [
          0.082,
          0.7793,
          0.9121,
          0.8989
        ]
      },
      "provenance": "native-text",
      "columns": [
        {
          "name": "joint",
          "header": "Joint",
          "type": "VARCHAR"
        },
        {
          "name": "thread",
          "header": "Thread",
          "type": "VARCHAR"
        },
        {
          "name": "tightening_torque",
          "header": "Tightening torque",
          "type": "VARCHAR"
        }
      ],
      "row_count": 4,
      "row_ids": [
        "r0002",
        "r0003",
        "r0004",
        "r0005"
      ]
    },
    {
      "id": "t06",
      "file": "t06.parquet",
      "locator": {
        "kind": "pdf-page",
        "page": 4,
        "bbox": [
          0.0823,
          0.0948,
          0.9126,
          0.262
        ]
      },
      "provenance": "native-text",
      "columns": [
        {
          "name": "task",
          "header": "Task",
          "type": "VARCHAR"
        },
        {
          "name": "interval",
          "header": "Interval",
          "type": "VARCHAR"
        }
      ],
      "row_count": 6,
      "row_ids": [
        "r0002",
        "r0003",
        "r0004",
        "r0005",
        "r0006",
        "r0007"
      ]
    },
    {
      "id": "t07",
      "file": "t07.parquet",
      "locator": {
        "kind": "pdf-page",
        "page": 4,
        "bbox": [
          0.082,
          0.314,
          0.9131,
          0.5044
        ]
      },
      "provenance": "native-text",
      "columns": [
        {
          "name": "parameter",
          "header": "Parameter",
          "type": "VARCHAR"
        },
        {
          "name": "alert",
          "header": "Alert",
          "type": "VARCHAR"
        },
        {
          "name": "alarm",
          "header": "Alarm",
          "type": "VARCHAR"
        }
      ],
      "row_count": 7,
      "row_ids": [
        "r0002",
        "r0003",
        "r0004",
        "r0005",
        "r0006",
        "r0007",
        "r0008"
      ]
    },
    {
      "id": "t08",
      "file": "t08.parquet",
      "locator": {
        "kind": "pdf-page",
        "page": 5,
        "bbox": [
          0.0808,
          0.0947,
          0.9131,
          0.4019
        ]
      },
      "provenance": "native-text",
      "columns": [
        {
          "name": "code",
          "header": "Code",
          "type": "VARCHAR"
        },
        {
          "name": "message",
          "header": "Message",
          "type": "VARCHAR"
        },
        {
          "name": "possible_causes",
          "header": "Possible causes",
          "type": "VARCHAR"
        },
        {
          "name": "checks_and_actions",
          "header": "Checks and actions",
          "type": "VARCHAR"
        }
      ],
      "row_count": 6,
      "row_ids": [
        "r0002",
        "r0003",
        "r0004",
        "r0005",
        "r0006",
        "r0007"
      ]
    }
  ]
}
