{
  "schema": 1,
  "source_id": "src-86cb00fd2f6b",
  "sensitivity": "public",
  "tables": [
    {
      "id": "t01",
      "file": "t01.parquet",
      "locator": {
        "kind": "docx-table",
        "table": 1,
        "row_start": 1,
        "row_end": 5
      },
      "provenance": "deterministic-table",
      "columns": [
        {
          "name": "field",
          "header": "Field",
          "type": "VARCHAR"
        },
        {
          "name": "value",
          "header": "Value",
          "type": "VARCHAR"
        }
      ],
      "row_count": 4,
      "row_ids": [
        "r0002",
        "r0003",
        "r0004",
        "r0005"
      ]
    },
    {
      "id": "t02",
      "file": "t02.parquet",
      "locator": {
        "kind": "docx-table",
        "table": 2,
        "row_start": 1,
        "row_end": 5
      },
      "provenance": "deterministic-table",
      "columns": [
        {
          "name": "action",
          "header": "Action",
          "type": "VARCHAR"
        },
        {
          "name": "work_order",
          "header": "Work order",
          "type": "VARCHAR"
        },
        {
          "name": "owner",
          "header": "Owner",
          "type": "VARCHAR"
        },
        {
          "name": "date",
          "header": "Date",
          "type": "VARCHAR"
        },
        {
          "name": "status",
          "header": "Status",
          "type": "VARCHAR"
        }
      ],
      "row_count": 4,
      "row_ids": [
        "r0002",
        "r0003",
        "r0004",
        "r0005"
      ]
    }
  ]
}
