{
  "schema": 1,
  "source_id": "src-4e79f89ff183",
  "sensitivity": "public",
  "tables": [
    {
      "id": "t01",
      "file": "t01.parquet",
      "locator": {
        "kind": "image-region",
        "page": 1,
        "region": 8,
        "bbox": [
          0.1158,
          0.2987,
          0.8775,
          0.7539
        ]
      },
      "provenance": "ocr",
      "columns": [
        {
          "name": "check",
          "header": "Check",
          "type": "VARCHAR"
        },
        {
          "name": "ok",
          "header": "OK",
          "type": "VARCHAR"
        },
        {
          "name": "not_ok",
          "header": "Not OK",
          "type": "VARCHAR"
        }
      ],
      "row_count": 10,
      "row_ids": [
        "r0002",
        "r0003",
        "r0004",
        "r0005",
        "r0006",
        "r0007",
        "r0008",
        "r0009",
        "r0010",
        "r0011"
      ]
    }
  ]
}
