{
  "schema": 1,
  "source_id": "src-9fd435ef5956",
  "sensitivity": "public",
  "tables": [
    {
      "id": "t01",
      "file": "t01.parquet",
      "locator": {
        "kind": "csv-rows",
        "row_start": 1,
        "row_end": 95
      },
      "provenance": "deterministic-table",
      "columns": [
        {
          "name": "wo_number",
          "header": "wo_number",
          "type": "VARCHAR"
        },
        {
          "name": "created",
          "header": "created",
          "type": "VARCHAR"
        },
        {
          "name": "turbine",
          "header": "turbine",
          "type": "VARCHAR"
        },
        {
          "name": "type",
          "header": "type",
          "type": "VARCHAR"
        },
        {
          "name": "title",
          "header": "title",
          "type": "VARCHAR"
        },
        {
          "name": "status",
          "header": "status",
          "type": "VARCHAR"
        },
        {
          "name": "priority",
          "header": "priority",
          "type": "VARCHAR"
        },
        {
          "name": "part_number",
          "header": "part_number",
          "type": "VARCHAR"
        },
        {
          "name": "part_qty",
          "header": "part_qty",
          "type": "BIGINT"
        },
        {
          "name": "assigned_to",
          "header": "assigned_to",
          "type": "VARCHAR"
        },
        {
          "name": "planned_date",
          "header": "planned_date",
          "type": "VARCHAR"
        },
        {
          "name": "completed_date",
          "header": "completed_date",
          "type": "VARCHAR"
        },
        {
          "name": "reference",
          "header": "reference",
          "type": "VARCHAR"
        },
        {
          "name": "remarks",
          "header": "remarks",
          "type": "VARCHAR"
        }
      ],
      "row_count": 94,
      "row_ids": [
        "r0002",
        "r0003",
        "r0004",
        "r0005",
        "r0006",
        "r0007",
        "r0008",
        "r0009",
        "r0010",
        "r0011",
        "r0012",
        "r0013",
        "r0014",
        "r0015",
        "r0016",
        "r0017",
        "r0018",
        "r0019",
        "r0020",
        "r0021",
        "r0022",
        "r0023",
        "r0024",
        "r0025",
        "r0026",
        "r0027",
        "r0028",
        "r0029",
        "r0030",
        "r0031",
        "r0032",
        "r0033",
        "r0034",
        "r0035",
        "r0036",
        "r0037",
        "r0038",
        "r0039",
        "r0040",
        "r0041",
        "r0042",
        "r0043",
        "r0044",
        "r0045",
        "r0046",
        "r0047",
        "r0048",
        "r0049",
        "r0050",
        "r0051",
        "r0052",
        "r0053",
        "r0054",
        "r0055",
        "r0056",
        "r0057",
        "r0058",
        "r0059",
        "r0060",
        "r0061",
        "r0062",
        "r0063",
        "r0064",
        "r0065",
        "r0066",
        "r0067",
        "r0068",
        "r0069",
        "r0070",
        "r0071",
        "r0072",
        "r0073",
        "r0074",
        "r0075",
        "r0076",
        "r0077",
        "r0078",
        "r0079",
        "r0080",
        "r0081",
        "r0082",
        "r0083",
        "r0084",
        "r0085",
        "r0086",
        "r0087",
        "r0088",
        "r0089",
        "r0090",
        "r0091",
        "r0092",
        "r0093",
        "r0094",
        "r0095"
      ]
    }
  ]
}
