{
  "schema": 1,
  "source_id": "src-aba30cb7207f",
  "sensitivity": "public",
  "tables": [
    {
      "id": "t01",
      "file": "t01.parquet",
      "locator": {
        "kind": "xlsx-rows",
        "sheet": "Tasks",
        "sheet_slug": null,
        "row_start": 1,
        "row_end": 16,
        "cols": null
      },
      "provenance": "deterministic-table",
      "columns": [
        {
          "name": "task_id",
          "header": "Task ID",
          "type": "VARCHAR"
        },
        {
          "name": "task",
          "header": "Task",
          "type": "VARCHAR"
        },
        {
          "name": "system",
          "header": "System",
          "type": "VARCHAR"
        },
        {
          "name": "interval",
          "header": "Interval",
          "type": "VARCHAR"
        },
        {
          "name": "procedure_or_reference",
          "header": "Procedure or reference",
          "type": "VARCHAR"
        },
        {
          "name": "duration_h",
          "header": "Duration (h)",
          "type": "DOUBLE"
        },
        {
          "name": "crew",
          "header": "Crew",
          "type": "BIGINT"
        },
        {
          "name": "notes",
          "header": "Notes",
          "type": "VARCHAR"
        }
      ],
      "row_count": 15,
      "row_ids": [
        "r0002",
        "r0003",
        "r0004",
        "r0005",
        "r0006",
        "r0007",
        "r0008",
        "r0009",
        "r0010",
        "r0011",
        "r0012",
        "r0013",
        "r0014",
        "r0015",
        "r0016"
      ]
    },
    {
      "id": "t02",
      "file": "t02.parquet",
      "locator": {
        "kind": "xlsx-rows",
        "sheet": "Plan 2026",
        "sheet_slug": null,
        "row_start": 1,
        "row_end": 109,
        "cols": null
      },
      "provenance": "deterministic-table",
      "columns": [
        {
          "name": "turbine",
          "header": "Turbine",
          "type": "VARCHAR"
        },
        {
          "name": "task_id",
          "header": "Task ID",
          "type": "VARCHAR"
        },
        {
          "name": "planned_months",
          "header": "Planned months",
          "type": "VARCHAR"
        },
        {
          "name": "status_at_2026_07_01",
          "header": "Status at 2026-07-01",
          "type": "VARCHAR"
        }
      ],
      "row_count": 108,
      "row_ids": [
        "r0002",
        "r0003",
        "r0004",
        "r0005",
        "r0006",
        "r0007",
        "r0008",
        "r0009",
        "r0010",
        "r0011",
        "r0012",
        "r0013",
        "r0014",
        "r0015",
        "r0016",
        "r0017",
        "r0018",
        "r0019",
        "r0020",
        "r0021",
        "r0022",
        "r0023",
        "r0024",
        "r0025",
        "r0026",
        "r0027",
        "r0028",
        "r0029",
        "r0030",
        "r0031",
        "r0032",
        "r0033",
        "r0034",
        "r0035",
        "r0036",
        "r0037",
        "r0038",
        "r0039",
        "r0040",
        "r0041",
        "r0042",
        "r0043",
        "r0044",
        "r0045",
        "r0046",
        "r0047",
        "r0048",
        "r0049",
        "r0050",
        "r0051",
        "r0052",
        "r0053",
        "r0054",
        "r0055",
        "r0056",
        "r0057",
        "r0058",
        "r0059",
        "r0060",
        "r0061",
        "r0062",
        "r0063",
        "r0064",
        "r0065",
        "r0066",
        "r0067",
        "r0068",
        "r0069",
        "r0070",
        "r0071",
        "r0072",
        "r0073",
        "r0074",
        "r0075",
        "r0076",
        "r0077",
        "r0078",
        "r0079",
        "r0080",
        "r0081",
        "r0082",
        "r0083",
        "r0084",
        "r0085",
        "r0086",
        "r0087",
        "r0088",
        "r0089",
        "r0090",
        "r0091",
        "r0092",
        "r0093",
        "r0094",
        "r0095",
        "r0096",
        "r0097",
        "r0098",
        "r0099",
        "r0100",
        "r0101",
        "r0102",
        "r0103",
        "r0104",
        "r0105",
        "r0106",
        "r0107",
        "r0108",
        "r0109"
      ]
    },
    {
      "id": "t03",
      "file": "t03.parquet",
      "locator": {
        "kind": "xlsx-rows",
        "sheet": "Oil sampling",
        "sheet_slug": null,
        "row_start": 1,
        "row_end": 13,
        "cols": null
      },
      "provenance": "deterministic-table",
      "columns": [
        {
          "name": "turbine",
          "header": "Turbine",
          "type": "VARCHAR"
        },
        {
          "name": "last_sample",
          "header": "Last sample",
          "type": "VARCHAR"
        },
        {
          "name": "report",
          "header": "Report",
          "type": "VARCHAR"
        },
        {
          "name": "oil",
          "header": "Oil",
          "type": "VARCHAR"
        },
        {
          "name": "fe_ppm",
          "header": "Fe (ppm)",
          "type": "BIGINT"
        },
        {
          "name": "pq_index",
          "header": "PQ index",
          "type": "BIGINT"
        },
        {
          "name": "condition",
          "header": "Condition",
          "type": "VARCHAR"
        },
        {
          "name": "next_sample_due",
          "header": "Next sample due",
          "type": "VARCHAR"
        }
      ],
      "row_count": 12,
      "row_ids": [
        "r0002",
        "r0003",
        "r0004",
        "r0005",
        "r0006",
        "r0007",
        "r0008",
        "r0009",
        "r0010",
        "r0011",
        "r0012",
        "r0013"
      ]
    },
    {
      "id": "t04",
      "file": "t04.parquet",
      "locator": {
        "kind": "xlsx-rows",
        "sheet": "Revision log",
        "sheet_slug": null,
        "row_start": 1,
        "row_end": 3,
        "cols": null
      },
      "provenance": "deterministic-table",
      "columns": [
        {
          "name": "issue",
          "header": "Issue",
          "type": "BIGINT"
        },
        {
          "name": "date",
          "header": "Date",
          "type": "VARCHAR"
        },
        {
          "name": "change",
          "header": "Change",
          "type": "VARCHAR"
        },
        {
          "name": "author",
          "header": "Author",
          "type": "VARCHAR"
        }
      ],
      "row_count": 2,
      "row_ids": [
        "r0002",
        "r0003"
      ]
    },
    {
      "id": "t05",
      "file": "t05.parquet",
      "locator": {
        "kind": "xlsx-rows",
        "sheet": "About",
        "sheet_slug": null,
        "row_start": 1,
        "row_end": 5,
        "cols": null
      },
      "provenance": "deterministic-table",
      "columns": [
        {
          "name": "fictional_not_for_operational_use",
          "header": "FICTIONAL - NOT FOR OPERATIONAL USE",
          "type": "VARCHAR"
        }
      ],
      "row_count": 4,
      "row_ids": [
        "r0002",
        "r0003",
        "r0004",
        "r0005"
      ]
    }
  ]
}
