{
  "schema": 1,
  "source_id": "src-65680eb5afcc",
  "sensitivity": "public",
  "tables": [
    {
      "id": "t01",
      "file": "t01.parquet",
      "locator": {
        "kind": "csv-rows",
        "row_start": 1,
        "row_end": 73
      },
      "provenance": "deterministic-table",
      "columns": [
        {
          "name": "month",
          "header": "month",
          "type": "VARCHAR"
        },
        {
          "name": "turbine",
          "header": "turbine",
          "type": "VARCHAR"
        },
        {
          "name": "availability_pct",
          "header": "availability_pct",
          "type": "DOUBLE"
        },
        {
          "name": "energy_mwh",
          "header": "energy_mwh",
          "type": "DOUBLE"
        },
        {
          "name": "downtime_h",
          "header": "downtime_h",
          "type": "DOUBLE"
        },
        {
          "name": "alarm_count",
          "header": "alarm_count",
          "type": "BIGINT"
        }
      ],
      "row_count": 72,
      "row_ids": [
        "r0002",
        "r0003",
        "r0004",
        "r0005",
        "r0006",
        "r0007",
        "r0008",
        "r0009",
        "r0010",
        "r0011",
        "r0012",
        "r0013",
        "r0014",
        "r0015",
        "r0016",
        "r0017",
        "r0018",
        "r0019",
        "r0020",
        "r0021",
        "r0022",
        "r0023",
        "r0024",
        "r0025",
        "r0026",
        "r0027",
        "r0028",
        "r0029",
        "r0030",
        "r0031",
        "r0032",
        "r0033",
        "r0034",
        "r0035",
        "r0036",
        "r0037",
        "r0038",
        "r0039",
        "r0040",
        "r0041",
        "r0042",
        "r0043",
        "r0044",
        "r0045",
        "r0046",
        "r0047",
        "r0048",
        "r0049",
        "r0050",
        "r0051",
        "r0052",
        "r0053",
        "r0054",
        "r0055",
        "r0056",
        "r0057",
        "r0058",
        "r0059",
        "r0060",
        "r0061",
        "r0062",
        "r0063",
        "r0064",
        "r0065",
        "r0066",
        "r0067",
        "r0068",
        "r0069",
        "r0070",
        "r0071",
        "r0072",
        "r0073"
      ]
    }
  ]
}
