{
  "schema": 1,
  "source_id": "src-824b788eefc0",
  "sensitivity": "public",
  "tables": [
    {
      "id": "t01",
      "file": "t01.parquet",
      "locator": {
        "kind": "docx-table",
        "table": 1,
        "row_start": 1,
        "row_end": 7
      },
      "provenance": "deterministic-table",
      "columns": [
        {
          "name": "champ",
          "header": "Champ",
          "type": "VARCHAR"
        },
        {
          "name": "valeur",
          "header": "Valeur",
          "type": "VARCHAR"
        }
      ],
      "row_count": 6,
      "row_ids": [
        "r0002",
        "r0003",
        "r0004",
        "r0005",
        "r0006",
        "r0007"
      ]
    },
    {
      "id": "t02",
      "file": "t02.parquet",
      "locator": {
        "kind": "docx-table",
        "table": 2,
        "row_start": 1,
        "row_end": 2
      },
      "provenance": "deterministic-table",
      "columns": [
        {
          "name": "revision",
          "header": "Révision",
          "type": "VARCHAR"
        },
        {
          "name": "date",
          "header": "Date",
          "type": "VARCHAR"
        },
        {
          "name": "modification",
          "header": "Modification",
          "type": "VARCHAR"
        }
      ],
      "row_count": 1,
      "row_ids": [
        "r0002"
      ]
    }
  ]
}
